{
	"type": "connection",
	"id": "companion-module-acme-widget",
	"name": "acme-widget",
	"shortname": "widget",
	"description": "Control an ACME Widget",
	"version": "1.0.0",
	"license": "MIT",
	"repository": "https://github.com/bitfocus/companion-module-acme-widget",
	"bugs": "https://github.com/bitfocus/companion-module-acme-widget/issues",
	"maintainers": [{ "name": "Jane Doe", "email": "jane@example.com" }],
	"legacyIds": [],
	"runtime": {
		"type": "node22",
		"api": "nodejs-ipc",
		"apiVersion": "0.0.0",
		"entrypoint": "../dist/main.js"
	},
	"manufacturer": "ACME",
	"products": ["Widget"],
	"keywords": ["widget"]
}
